{
  "$schema": "http://json-schema.org/draft-07/schema#",
  "$id": "https://console.local/repo.manifest.schema.json",
  "title": "Repo Boundary Manifest",
  "description": "Schema for repo.manifest.json — the single source of truth for workspace boundaries.",
  "type": "object",
  "required": ["version", "workspaces"],
  "additionalProperties": true,
  "properties": {
    "$schema": { "type": "string" },
    "version": { "type": "integer", "const": 1 },
    "description": { "type": "string" },
    "conventions": { "type": "object" },
    "workspaces": {
      "type": "array",
      "minItems": 1,
      "items": { "$ref": "#/definitions/workspace" }
    }
  },
  "definitions": {
    "workspace": {
      "type": "object",
      "required": ["id", "name", "kind", "path", "owns"],
      "additionalProperties": false,
      "properties": {
        "id": {
          "type": "string",
          "pattern": "^(app|pkg|root):?[a-z0-9-]*$",
          "description": "Stable id used in prompts and .agent scope. e.g. app:web, pkg:ui, root."
        },
        "name": { "type": "string" },
        "kind": { "enum": ["app", "package", "config", "root"] },
        "path": { "type": "string" },
        "port": { "type": "integer" },
        "owns": {
          "type": "array",
          "items": { "type": "string" },
          "description": "Glob(s) of files this workspace owns. Used by the scope-guard and CODEOWNERS."
        },
        "mayImport": {
          "type": "array",
          "items": { "type": "string" },
          "description": "Workspaces/packages this one is allowed to import."
        },
        "mayNotImport": {
          "type": "array",
          "items": { "type": "string" }
        },
        "standalone": {
          "type": "boolean",
          "description": "Whether this app can run on its own with no peer services."
        },
        "run": { "type": "string" },
        "affectsAllApps": {
          "type": "boolean",
          "description": "True for shared packages/root: an edit here has cross-app blast radius."
        },
        "publicEntry": {
          "type": "array",
          "items": { "type": "string" },
          "description": "The only legal import paths (must match package.json exports)."
        },
        "protectedPaths": {
          "type": "array",
          "items": { "type": "string" },
          "description": "Globally-impactful files (tokens, fixtures) that require extra care."
        },
        "generatedPaths": {
          "type": "array",
          "items": { "type": "string" },
          "description": "Files produced by a generator; hand-editing is discouraged — regenerate instead."
        },
        "description": { "type": "string" }
      }
    }
  }
}
